{
  "schemaVersion": "workshop-ci-report-v1",
  "generatedAt": "2026-08-24T15:04:01Z",
  "generatedFrom": "result-ec4195803615",
  "verdict": "needs-review",
  "verdictLabel": "Needs review",
  "summary": "1 finding; 5 checks not run. Review them before this change progresses.",
  "scope": {
    "checked": "the exact Kubernetes objects and the completed checks listed in this report",
    "notProven": "destination acceptance, deployment, workload health, drift, and rollback unless separate receipts are linked"
  },
  "source": {
    "type": "helm",
    "identity": "bitnami/nginx",
    "version": "24.0.2",
    "valuesSummary": "examples/byo-helm-values/reviewed-values.yaml"
  },
  "candidate": {
    "objectCount": 5,
    "objectSetSha256": "sha256:502d8c85470455fa4152f8d0abb9d1582552e830148e90335e9649cbfd42f397",
    "contentSha256": "sha256:ec4195803615b2e0d31e82488a16e0ab190ade8ddb0d3b892ceee6c3a724c8b6"
  },
  "comparison": {
    "status": "compared",
    "added": [],
    "removed": [],
    "changed": [
      "Deployment/nginx/nginx",
      "Service/nginx/nginx"
    ],
    "unchanged": [
      "NetworkPolicy/nginx/nginx",
      "PodDisruptionBudget/nginx/nginx",
      "ServiceAccount/nginx/nginx"
    ]
  },
  "findings": [
    {
      "id": "CCVE-2025-3745",
      "severity": "info",
      "resource": "Deployment/nginx/nginx",
      "message": "Volume empty-dir uses emptyDir without sizeLimit; may exhaust node disk",
      "decision": "approved-exception",
      "controlIds": [],
      "nextAction": "Set sizeLimit on all emptyDir volumes"
    }
  ],
  "checks": {
    "completed": [
      "Kubernetes object inventory",
      "shared local configuration checks from a matching cub check result",
      "semantic comparison with the supplied object set",
      "Catalog source and lifecycle record retained with the result",
      "finding decisions bound to the accepted object set"
    ],
    "notRun": [
      "source rendering and values provenance beyond the supplied source record",
      "Kubernetes schema and admission behavior",
      "hook execution and CRD establishment",
      "live workload health and drift",
      "database migrations and external services"
    ],
    "localScanner": {
      "authority": "local-advisory",
      "tool": "cub-scan",
      "version": "v0.7.3",
      "scanTime": "2026-08-24T15:04:01Z",
      "patternBundleVersion": "v0.7.3",
      "patternBundleManifestSha256": "sha256:0405f6ffe21e567adf5d6a732d181c7f228194920456d046b4338baeb14de1a8",
      "objectSetMatched": true
    },
    "managedValidation": "not-recorded-by-this-local-report",
    "destination": "not-checked",
    "delivery": "not-checked",
    "runtime": "not-checked"
  },
  "lifecycle": {
    "requirements": [
      {
        "detail": "The destination must supply the AI provider Secret before delivery.",
        "id": "nginx/ai-provider-credentials",
        "origin": "reviewed-values",
        "type": "target-fact"
      }
    ],
    "routes": [],
    "targetFactsStatus": "recorded",
    "resolutionStatus": "resolved-for-development-and-staging-proof"
  },
  "decision": {
    "status": "recorded",
    "record": {
      "path": "config-catalog/review-decisions/byo-nginx-ai-values-24-0-2-reviewed.yaml",
      "sha256": "sha256:4689f859fd85e52beb7c9ca34dadf88e7621ac11ac5f98757603f1cd7e640b2a",
      "apiVersion": "workshop.confighub.com/v1alpha1",
      "kind": "ConfigurationDecision",
      "name": "byo-nginx-ai-values-24-0-2-reviewed"
    },
    "outcomes": [
      {
        "findingId": "CCVE-2025-3745",
        "decision": "approved-exception",
        "rationale": "The chart uses one emptyDir for temporary NGINX files. The bounded development and staging demonstrations ran on throwaway kind clusters; this exception does not authorize a production target.",
        "controlIds": [],
        "exception": {
          "appliesTo": [
            "the exact accepted candidate digest",
            "development and staging demonstrations on throwaway kind clusters"
          ],
          "excludes": [
            "production",
            "customer clusters",
            "any later object-set digest"
          ],
          "reviewBy": "2026-11-30T23:59:59Z"
        }
      }
    ]
  },
  "artifacts": [
    {
      "path": "candidate.yaml",
      "sha256": "sha256:ec4195803615b2e0d31e82488a16e0ab190ade8ddb0d3b892ceee6c3a724c8b6",
      "url": "./candidate.yaml"
    },
    {
      "path": "comparison.yaml",
      "sha256": "sha256:ae6bc63d5005bfef5fb62400619290bafe56d5bd9e2e58922f21757882ee1593",
      "url": "./comparison.yaml"
    },
    {
      "path": "source-and-intent.yaml",
      "sha256": "sha256:1841c109d0d1c6e932bc46d02b082cb964f129015366d6b16c803466ff0fd163",
      "url": "./source-and-intent.yaml"
    },
    {
      "path": "cub-check.json",
      "sha256": "sha256:3c0ed08754dd08296949cb0308f8c16952769d6dd266afe0e9e17dec3ec58b96",
      "url": "./cub-check.json"
    },
    {
      "path": "configuration-decision.yaml",
      "sha256": "sha256:4689f859fd85e52beb7c9ca34dadf88e7621ac11ac5f98757603f1cd7e640b2a",
      "url": "./configuration-decision.yaml"
    },
    {
      "path": "workshop-review.json",
      "sha256": "sha256:848d523d519ab452fcfb82649907ca75b52020a60cee9b313462ffbb5c5b72e3",
      "url": "./workshop-review.json"
    },
    {
      "path": "Catalog record",
      "sha256": "",
      "url": "https://confighub.github.io/helm-expt/site/charts/bitnami-nginx-24-0-2.html"
    }
  ],
  "nextActions": [
    "CCVE-2025-3745: recheck the approved exception when its object set, scope, or review date changes.",
    "nginx/ai-provider-credentials: The destination must supply the AI provider Secret before delivery.",
    "Run destination and live checks separately before deployment.",
    "Keep this result with the change, or publish candidate.yaml as OCI using the local tools you already use. Reopen the decision when the object set, destination, or review date changes.",
    "Retain candidate.yaml in ConfigHub with annotation workshop.confighub.com/object-set-sha256=sha256:502d8c85470455fa4152f8d0abb9d1582552e830148e90335e9649cbfd42f397 when the result needs shared history, validation, variants, promotion, release, or live comparison."
  ]
}
